{"grao":"1 linha por região × semana (últimas 52)","dimensoes":{"semana_inicio":["2016-12-07","2016-12-14","2016-12-21","2016-12-28","2017-01-04","2017-01-11","2017-01-18","2017-01-25","2017-02-01","2017-02-08","2017-02-15","2017-02-22","2017-03-01","2017-03-08","2017-03-15","2017-03-22","2017-03-29","2017-04-05","2017-04-12","2017-04-19","2017-04-26","2017-05-03","2017-05-10","2017-05-17","2017-05-24","2017-05-31","2017-06-07","2017-06-14","2017-06-21","2017-06-28","2017-07-05","2017-07-12","2017-07-19","2017-07-26","2017-08-02","2017-08-09","2017-08-16","2017-08-23","2017-08-30","2017-09-06","2017-09-13","2017-09-20","2017-09-27","2017-10-04","2017-10-11","2017-10-18","2017-10-25","2017-11-01","2017-11-08","2017-11-15","2017-11-22","2017-11-29"],"regiao":["Região A","Região B","Região C","Região D","Região E","Região F","Lojas pequenas"]},"colunas":["semana_inicio","regiao","faturamento","indice"],"linhas":[[0,0,21471.59,100.3],[0,1,17088.79,107.3],[0,2,15265.47,103.7],[0,3,13213.34,94.9],[0,4,12634.34,111.5],[0,5,2835.25,100.6],[0,6,1274.51,134.3],[1,0,21816.17,101.9],[1,1,14488.45,91.0],[1,2,13721.15,93.2],[1,3,12196.42,87.6],[1,4,10976.01,96.9],[1,5,3408.41,120.9],[1,6,1163.22,122.6],[2,0,19444.3,90.8],[2,1,16417.92,103.1],[2,2,13582.06,92.2],[2,3,13440.21,96.5],[2,4,11913.44,105.1],[2,5,2773.94,98.4],[2,6,793.35,83.6],[3,0,19222.75,89.8],[3,1,14883.9,93.5],[3,2,13207.99,89.7],[3,3,12537.96,90.0],[3,4,12465.13,110.0],[3,5,2938.31,104.2],[3,6,1124.92,118.6],[4,0,22108.69,103.2],[4,1,15666.76,98.4],[4,2,14450.68,98.1],[4,3,13661.81,98.1],[4,4,10428.8,92.0],[4,5,2735.5,97.0],[4,6,938.58,98.9],[5,0,20374.1,95.1],[5,1,15710.42,98.7],[5,2,13819.32,93.9],[5,3,13898.62,99.8],[5,4,10776.81,95.1],[5,5,3596.41,127.6],[5,6,1320.0,139.1],[6,0,21499.02,100.4],[6,1,15904.96,99.9],[6,2,14699.02,99.8],[6,3,14023.6,100.7],[6,4,11274.45,99.5],[6,5,3298.06,117.0],[6,6,1327.48,139.9],[7,0,18779.96,87.7],[7,1,12714.95,79.9],[7,2,14802.45,100.5],[7,3,13021.29,93.5],[7,4,10959.6,96.7],[7,5,2528.79,89.7],[7,6,832.03,87.7],[8,0,18805.22,87.8],[8,1,13639.95,85.7],[8,2,15112.15,102.6],[8,3,11888.8,85.4],[8,4,11011.27,97.2],[8,5,2962.11,105.1],[8,6,795.26,83.8],[9,0,22971.44,107.3],[9,1,17031.38,107.0],[9,2,16063.86,109.1],[9,3,14733.82,105.8],[9,4,12272.18,108.3],[9,5,3942.9,139.8],[9,6,1469.98,154.9],[10,0,22586.48,105.5],[10,1,15531.49,97.6],[10,2,15139.15,102.8],[10,3,13266.83,95.3],[10,4,11924.96,105.2],[10,5,3060.98,108.6],[10,6,971.11,102.4],[11,0,21586.48,100.8],[11,1,14420.67,90.6],[11,2,15351.17,104.3],[11,3,13415.13,96.3],[11,4,12088.04,106.7],[11,5,2817.47,99.9],[11,6,1506.16,158.7],[12,0,19199.38,89.6],[12,1,16164.38,101.5],[12,2,14575.97,99.0],[12,3,14148.94,101.6],[12,4,11824.22,104.3],[12,5,2160.42,76.6],[12,6,1177.67,124.1],[13,0,22646.22,105.7],[13,1,18665.35,117.2],[13,2,15728.18,106.8],[13,3,13143.11,94.4],[13,4,10467.8,92.4],[13,5,2789.61,98.9],[13,6,1003.3,105.7],[14,0,23190.17,108.3],[14,1,16695.5,104.9],[14,2,13985.92,95.0],[14,3,13274.34,95.3],[14,4,11194.84,98.8],[14,5,3255.9,115.5],[14,6,1301.82,137.2],[15,0,21738.5,101.5],[15,1,15297.81,96.1],[15,2,13347.67,90.6],[15,3,12733.1,91.4],[15,4,11537.03,101.8],[15,5,2808.33,99.6],[15,6,930.74,98.1],[16,0,18002.75,84.1],[16,1,12764.8,80.2],[16,2,12058.23,81.9],[16,3,11723.26,84.2],[16,4,11837.09,104.5],[16,5,2532.63,89.8],[16,6,687.9,72.5],[17,0,21710.78,101.4],[17,1,16911.92,106.2],[17,2,14748.22,100.2],[17,3,13390.56,96.2],[17,4,11151.57,98.4],[17,5,2530.29,89.7],[17,6,1187.5,125.2],[18,0,22508.19,105.1],[18,1,17920.95,112.6],[18,2,16330.77,110.9],[18,3,14782.49,106.2],[18,4,13070.44,115.3],[18,5,3796.64,134.7],[18,6,1091.94,115.1],[19,0,20773.29,97.0],[19,1,15549.21,97.7],[19,2,13857.35,94.1],[19,3,12206.51,87.7],[19,4,9594.11,84.7],[19,5,3105.06,110.1],[19,6,1108.08,116.8],[20,0,18020.7,84.1],[20,1,14959.61,94.0],[20,2,13298.0,90.3],[20,3,14447.49,103.8],[20,4,12112.05,106.9],[20,5,2083.15,73.9],[20,6,1006.16,106.0],[21,0,19048.9,88.9],[21,1,14633.5,91.9],[21,2,13076.48,88.8],[21,3,13379.13,96.1],[21,4,10778.08,95.1],[21,5,2107.72,74.8],[21,6,690.03,72.7],[22,0,23359.56,109.1],[22,1,17275.68,108.5],[22,2,16248.69,110.3],[22,3,14145.62,101.6],[22,4,11732.22,103.5],[22,5,3347.08,118.7],[22,6,995.84,105.0],[23,0,21754.58,101.6],[23,1,14578.28,91.6],[23,2,13528.71,91.9],[23,3,13406.23,96.3],[23,4,11126.8,98.2],[23,5,2427.09,86.1],[23,6,1015.14,107.0],[24,0,19904.12,92.9],[24,1,14244.72,89.5],[24,2,13680.43,92.9],[24,3,13337.78,95.8],[24,4,11100.85,98.0],[24,5,2879.03,102.1],[24,6,851.42,89.7],[25,0,20199.93,94.3],[25,1,14552.81,91.4],[25,2,12874.49,87.4],[25,3,13365.82,96.0],[25,4,10027.39,88.5],[25,5,2735.71,97.0],[25,6,589.1,62.1],[26,0,19238.46,89.8],[26,1,15887.46,99.8],[26,2,14202.59,96.5],[26,3,14593.46,104.8],[26,4,11463.97,101.2],[26,5,2072.91,73.5],[26,6,1688.4,178.0],[27,0,23503.9,109.7],[27,1,16972.03,106.6],[27,2,14480.95,98.3],[27,3,14807.2,106.3],[27,4,10747.4,94.8],[27,5,3264.74,115.8],[27,6,865.4,91.2],[28,0,18588.4,86.8],[28,1,14146.63,88.9],[28,2,13830.89,93.9],[28,3,13024.65,93.5],[28,4,10896.26,96.2],[28,5,2725.71,96.7],[28,6,817.28,86.1],[29,0,18924.96,88.4],[29,1,14822.37,93.1],[29,2,13459.17,91.4],[29,3,12490.33,89.7],[29,4,10968.73,96.8],[29,5,3170.1,112.4],[29,6,1073.82,113.2],[30,0,20778.95,97.0],[30,1,14908.19,93.6],[30,2,12912.52,87.7],[30,3,13794.78,99.1],[30,4,10331.49,91.2],[30,5,2282.46,81.0],[30,6,1003.06,105.7],[31,0,21528.74,100.5],[31,1,18463.6,116.0],[31,2,14481.68,98.3],[31,3,13492.54,96.9],[31,4,11157.99,98.5],[31,5,3331.99,118.2],[31,6,791.9,83.5],[32,0,20099.37,93.8],[32,1,16057.11,100.9],[32,2,14412.11,97.9],[32,3,13938.29,100.1],[32,4,10916.32,96.3],[32,5,2624.62,93.1],[32,6,892.67,94.1],[33,0,19821.01,92.5],[33,1,14482.73,91.0],[33,2,14493.63,98.4],[33,3,13085.23,94.0],[33,4,11300.58,99.7],[33,5,2218.88,78.7],[33,6,707.1,74.5],[34,0,21680.04,101.2],[34,1,13779.07,86.6],[34,2,16702.11,113.4],[34,3,11640.97,83.6],[34,4,11566.62,102.1],[34,5,2169.61,76.9],[34,6,869.16,91.6],[35,0,22765.56,106.3],[35,1,19202.87,120.6],[35,2,16238.43,110.3],[35,3,15958.17,114.6],[35,4,11708.16,103.3],[35,5,3889.41,137.9],[35,6,779.7,82.2],[36,0,21821.91,101.9],[36,1,15117.94,95.0],[36,2,14636.33,99.4],[36,3,12928.36,92.9],[36,4,11014.53,97.2],[36,5,2886.17,102.4],[36,6,621.22,65.5],[37,0,21233.79,99.1],[37,1,16423.48,103.2],[37,2,16080.56,109.2],[37,3,15192.82,109.1],[37,4,11612.13,102.5],[37,5,2567.3,91.1],[37,6,585.96,61.8],[38,0,22475.6,104.9],[38,1,17005.83,106.8],[38,2,15295.76,103.9],[38,3,15262.99,109.6],[38,4,11682.16,103.1],[38,5,2241.29,79.5],[38,6,920.22,97.0],[39,0,21898.67,102.2],[39,1,15742.22,98.9],[39,2,17354.92,117.9],[39,3,13018.69,93.5],[39,4,11459.14,101.1],[39,5,2923.86,103.7],[39,6,487.09,51.3],[40,0,22005.05,102.7],[40,1,16724.47,105.1],[40,2,15994.97,108.6],[40,3,15562.41,111.8],[40,4,11465.66,101.2],[40,5,3172.4,112.5],[40,6,631.91,66.6],[41,0,21737.45,101.5],[41,1,13582.85,85.3],[41,2,16427.84,111.6],[41,3,13370.24,96.0],[41,4,11628.99,102.6],[41,5,2051.36,72.8],[41,6,595.21,62.7],[42,0,27360.53,127.7],[42,1,19231.79,120.8],[42,2,18466.18,125.4],[42,3,20482.12,147.1],[42,4,13321.45,117.6],[42,5,3225.65,114.4],[42,6,1061.52,111.9],[43,0,19536.68,91.2],[43,1,15019.77,94.3],[43,2,12777.43,86.8],[43,3,14054.81,100.9],[43,4,10214.94,90.1],[43,5,2660.73,94.4],[43,6,623.19,65.7],[44,0,24060.23,112.3],[44,1,17460.42,109.7],[44,2,16005.58,108.7],[44,3,16551.9,118.9],[44,4,11099.21,98.0],[44,5,3334.74,118.3],[44,6,485.99,51.2],[45,0,22695.34,106.0],[45,1,16448.78,103.3],[45,2,15965.91,108.4],[45,3,13808.79,99.2],[45,4,9644.83,85.1],[45,5,3063.0,108.6],[45,6,613.7,64.7],[46,0,22688.09,105.9],[46,1,16152.39,101.5],[46,2,13271.73,90.1],[46,3,15050.5,108.1],[46,4,9983.36,88.1],[46,5,2596.77,92.1],[46,6,577.02,60.8],[47,0,22555.2,105.3],[47,1,16464.03,103.4],[47,2,14151.9,96.1],[47,3,13553.39,97.3],[47,4,11102.96,98.0],[47,5,2797.34,99.2],[47,6,1049.53,110.6],[48,0,24728.67,115.5],[48,1,17686.57,111.1],[48,2,16135.61,109.6],[48,3,17118.28,122.9],[48,4,12034.4,106.2],[48,5,2411.14,85.5],[48,6,978.71,103.2],[49,0,25365.35,118.4],[49,1,19322.59,121.4],[49,2,15598.7,105.9],[49,3,16429.16,118.0],[49,4,13944.31,123.1],[49,5,2616.12,92.8],[49,6,893.03,94.1],[50,0,24883.29,116.2],[50,1,17760.11,111.6],[50,2,15277.05,103.7],[50,3,14823.13,106.5],[50,4,10495.74,92.6],[50,5,2336.52,82.9],[50,6,1400.64,147.6],[51,0,19033.31,88.9],[51,1,15249.21,95.8],[51,2,14485.09,98.4],[51,3,13217.94,94.9],[51,4,11192.4,98.8],[51,5,2527.14,89.6],[51,6,1169.03,123.2]]}